Category,Message
TRUE,"Obstruction was Fersen's chief weapon, and he continued to postpone the granting of subsidies by the house of nobles for some weeks."
TRUE,On monuments and cylinders he is represented as armed with the weapon with which he despatched the monster Tiamat.
TRUE,"He would find, in theory at least, that he possessed a weapon of matchless power and precision."
TRUE,"Little conspiracies were got up to displace him, and might have succeeded but for an unconquerable dread of the weapon that destroyed Peel."
TRUE,In either case his resistance only served to give a weapon to his enemies in the Assembly.
TRUE,"With sabort and experience a mass of flint can be worked to any simple shape by well directed strokes, and further trimming can be effected with pressure by a pointed stone in a direction slightly across the edge of the weapon."
TRUE,"The Celts cared nothing for the king except as a weapon against the Protestants; the old Anglo-Irish Catholics cared much, but the nearer Charles approached them the more completely he alienated the Protestants."
TRUE,"By proposing to allow the president of the Assembly to call in armed force, the questors revealed the Assembly's plans for defence, and gave the Elysee a weapon against it (""donnent barre contre elle a l'Elysee"")."
TRUE,"Thus his raid upon Dobrzyn, the latest acquisition of the knights on Polish soil, speedily gave them a ready weapon against him."
TRUE,"Not merely did he fight for the Protestant cause as a preacher and theologian, but he was almost the only member of Luther's party who was able to confront the Roman Catholics with the weapon of literary satire."
TRUE,"In 1280 he was wounded in the head with a dart, and as he retained there a part of the weapon for a year, he was called "" Otto with the dart."""
TRUE,"He reloaded his weapon first, then entered his bedroom for a new shirt."
TRUE,"I can master any weapon without really trying, Jonny said, a touch of pride in his voice."
TRUE,"Any weapon I come across, I can master without even trying!"
TRUE,"If what the Watcher said was remotely true, she was a powerful weapon in the hands of the Others, and he had limited otherworldly ability to protect her from them."
TRUE,Any hope he'd had of finding somethingâ€”anything!â€”to use as a weapon was dashed as he looked around the sparsely decorated room.
TRUE,One of the members of Jonny's own personal guard had shifted forward and was discreetly drawing the weapon at his thigh.
TRUE,"One of Dusty's spies found out the Others have a weapon they want to use, we think to open the gateway between the immortal and mortal worlds."
TRUE,"Czerno was already there and with him, a secret weapon, one that made the vamp believe they'd win before he'd been shot down."
TRUE,"Every ship, every weapon they own, came from Anshan ore."
TRUE,"Brady peeled his face mask off and lowered the muzzle of his weapon, unnerved by the unrealistic utopia after the three-day battle up the side of the mountain."
TRUE,It would make a formidable weapon if he was anything other than what she suspected.
TRUE,What if that weapon had a taste for blood and didn't want to stop?
TRUE,"Every campaign, he gave it to her for safekeeping, in case the weapon of an enemy severed the leather cord and it was lost."
TRUE,Banal lyrics with meaning and worth is another essential weapon in a jazz singer's armory.
TRUE,"Subjects include aeronautics, astronautics, military vehicle and weapon technology, and electronic and information warfare."
TRUE,"An extremely effective area weapon, the EMP produced by a nuclear airburst would undoubtedly produce severe damage to the civilian infrastructure."
TRUE,"Airspace weapon systems Current programs include Scramjet, future air-to-surface guided weapons, Storm Shadow and attack helicopter air-to-surface weapons."
TRUE,Iraq has made several attempts to buy high-strength aluminum tubes used to enrich uranium for a nuclear weapon.
TRUE,The ability to fire a weapon outside the defensive armaments of an enemy bomber had obvious advantages.
TRUE,A man is not armed because he has custody of a weapon.
TRUE,Not everyone who performs well with his weapon possesses this attribute.
TRUE,"This weapon is prayer, which, she wrote, ' is as sure as my two-handed backhand."
TRUE,It has always been intended to produce the weapon in caliber 7-08 for jurisdictions where 30 caliber weapons are forbidden.
TRUE,"Today, with the empire long dismantled, a rearticulated national chauvinism is a much more useful weapon."
TRUE,"A responsive, informed citizenry is the best weapon we have against crime."
TRUE,When infra-red homing is used decoy hot sources may be used to deflect the incoming weapon.
TRUE,"Later, when the tank became a serious tactical weapon, anti-tank ditches were added to the first line of defense."
TRUE,"At first glance two pieces of wood strung together by a length of cord, may not look too fearsome a weapon."
TRUE,The competition has been run successfully for the last 3 years and attracts the top ranking national fencers in each weapon.
TRUE,"With the withdrawal of a Rn fencer with an injury the RAF took victory against the RN 2-1, again taking the weapon win."
TRUE,"It became a ratings weapon for ITV, deployed whenever the channel needed a fillip or to attract viewers to an entirely different series."
TRUE,"Firstly rather than your bare fists, you have a weapon, or pair of weapons, at your disposal."
TRUE,"Rather, they deliberately foment sectarianism, a traditional weapon of colonizers."
TRUE,What do you do if you ca n't frag some one by running at them and blasting your weapon?
TRUE,"Our splendid main battle tank is almost impervious to the rocket propelled grenade, which is the weapon of choice of the enemy."
TRUE,It's a pretty lethal weapon in inexperienced hands.
TRUE,"Nonlethal weapons are legal with respect to jus in bello if the effects of the weapon are not long-term, debilitating, or irreversible."
TRUE,The new design does not require any modification to the mating weapon connector or aircraft.
TRUE,Weapon No 312 Bayonet Triangular Common Socket - Prior to 1814 A pattern bayonet used on British smooth bore muskets prior to 1814.
TRUE,Even possession of a (normally) two-handed weapon such as the spear didn't obviate the necessity of acquiring empty-handed saborts.
TRUE,The rear sight should not obtrude anymore than necessary above the weapon itself.
TRUE,"If you usually carry a penknife, make sure you leave it behind as the police could conceivably construe it as an offensive weapon."
TRUE,Tina is a highly ranked squash player in Austria and is Marcel's secret weapon for the team event in Vienna.
TRUE,"His examples will run from bee-keepers and pigeon-fanciers to those anxious and willing to use poison gas, the period weapon of mass destruction."
TRUE,"On the other hand, the weapon models are very good some even looking like they have more polys than the player models."
TRUE,"The Charter neither expressly prohibits, nor permits, the use of any specific weapon, including nuclear weapons."
TRUE,"When a uranium-tipped weapon hits an object, it produces a vapor that is weakly radioactive."
TRUE,"The weapon, tho, has not been used of late and is rather rusty."
TRUE,"After a colored sash is finished, it is possible to take a weapon grading."
TRUE,In so doing he gave away a highly serviceable political weapon.
TRUE,The traditional Irish shillelagh or cudgel is one example of a weapon made with this wood.
TRUE,"The all-woman shortlist, in short, has been a crucial weapon in the fight to secure more women MPs representing Welsh seats."
TRUE,He persisted in sending shrapnel - a useless weapon in trench warfare.
TRUE,The siege Tower was an invaluable Medieval siege attack weapon.
TRUE,But the funny remark made with apparent sincerity was not the only weapon in her humorous armory.
TRUE,No in-game yet as we are still needing a weapon skinner.
TRUE,A sling shot in my hands is a kid's toy A sling shot in my hands is a kid's toy A sling shot in David's hand was a mighty weapon.
TRUE,"An economic weapon, wheat smut, designed to attack crops, was also being experimented with."
TRUE,The weapon shown has a solenoid fitted on the right hand side of the body.
TRUE,"However, putting a culture containing millions of bacillus anthracis spores into a form that makes an effective weapon is not easy."
TRUE,"These include kick, lightening strike, weapon strip frying pan to the head and penalty box."
TRUE,Every move that Ryu pulls off with every weapon looks completely realistic and supremely stylish.
TRUE,"The Mangonel was an invaluable Medieval siege attack weapon, similar to a catapult which worked by using torsion or counterpoise."
TRUE,For the first time since the Greek trireme the ship reemerged as a weapon in its own right.
TRUE,The Effects of Anthrax In 1941 the Russians developed tularemia as a biological weapon.
TRUE,"After a quick twirl of the weapon to show off, she punched with her left and staked with her right."
TRUE,"Then thirdly, he was unconventional in that he used an unconventional weapon."
TRUE,Donald Martin's witness box weapon of choice was pure vitriol.
TRUE,"Tho the machine guns seem weak, they are the best and most accurate weapon if used correctly."
TRUE,"Yesterday, another activist was arrested for possessing an offensive weapon, taking the total number of arrests to 39."
TRUE,Iraq could make nuclear weapon in months to a year once it acquires sufficient weapons-grade fissile material.
TRUE,"Though rejected by the Jesuits, who found peripatetic formulae a faithful weapon against the enemies of the church, Cartesianism was warmly adopted by the Oratory, which saw in Descartes something of St Augustine, by Port Royal, which discovered a connexion between the new system and Jansenism, and by some amongst the Benedictines and the order of Ste Genevieve."
TRUE,"In his Autobiography he alleges that he learned from the Provincial Letters of Pascal "" to manage the weapon of grave and temperate irony, even on subjects of ecclesiastical solemnity."""
TRUE,"It took up, too, the Democratic weapon of states' rights, and in New England carried sectionalism dangerously near secession in 1808, and in 1812-1814,during the movement, in opposition to the war of 1812, which culminated in the Hartford Convention (see Hartford)."
TRUE,She had been making out with a man who might be involved in drug trafficking.
TRUE,He was living off of the proceeds of illegal drugs trafficking.
TRUE,"Mary was adamant about the fact that, for the surrogate mother, it was basically trafficking babies."
TRUE,Seven people have been arrested as part of a nationwide crackdown on the trafficking of women into a life of vise.
TRUE,"While the women hosting purse parties may not realize it, they are often at the bottom of a much larger illegal trafficking chain of counterfeit goods."
TRUE,The main focus of my research is to clarify the role of Rab GTPases in regulating vesicular trafficking in osteoclasts.
TRUE,"An admitted gang member, he was arrested and convicted of cocaine trafficking at an early age."
TRUE,"Like its predecessor, this title puts you into the action as a Navy SEAL who must stop forces who are engaged in weapon and drug trafficking."
TRUE,"Bedingfield is also active with a group called Stop the Traffik, which works to put an end to global human trafficking and Bono's (RED) campaign to raises awareness of poverty in Africa."
TRUE,His country was also encouraged by the attention being given to the scourge of illicit trafficking in small arms.
TRUE,"It is therefore, likely that defects in synaptic vesicle trafficking may be associated with specific sub-forms of schizophrenia."
TRUE,MySpace Tracker is a very clean but detailed and user-friendly site that gives you accurate and current information on your profile trafficking pages.
TRUE,Police drug traffickers arrested A fourth police officer in the southern province of Inhambane has been arrested for trafficking in the drug hashish.
TRUE,The fight against the illicit traffic in cultural property The extent of illicit trafficking has never been greater.
TRUE,They had been living a lavish lifestyle over a four year period principally funded from the proceeds of illegal drugs trafficking.
TRUE,These include components of signaling pathways and ubiquitin ligase proteins that regulate signal receptor trafficking.
TRUE,"Once relatively stable, even sleepy, Karachi became a nexus for drug and arms trafficking in the 1980s."
TRUE,The majority of cases concern trafficking into forced prostitution from Eastern Europe.
TRUE,"In Africa, illicit trafficking in small and light arms had become a major scourge."
TRUE,Why were they not raiding a drugs den or a human trafficking sex slave brothel instead?
TRUE,"This was followed by La Nuova Italia ed i Vecchi Zelanti (1881), another attack on the Vatican policy; and by his Vaticano Regio (1883), in which he accuses the Vatican of trafficking in holy things and declares that the taint of worldliness came from the false principles accepted by the Curia."
TRUE,The investigations of the most recent of Talleyrand's biographers tend to show that the charges made against him of trafficking with the envoys have been overdrawn; but all his apologists admit that irregularities occurred.
TRUE,He could not have become suddenly blind to the fallacy of the expectations derived from such a course; and all his life it had been his distinction to look above the transient and trafficking expedients of the professional politician.
TRUE,"This unscrupulous proceeding, known as the Secularizations (February 1803), was carried out largely on lines laid down by Bonaparte and Talleyrand; and the latter is known to have made large sums of money by trafficking with the claimants of church lands."
TRUE,"Some kinds are made close and dense in texture, for carrying such seed as poppy or rape and sugar; others less close are used for rice, pulses, and seeds of like size, and coarser and opener kinds again are woven for the outer cover of packages and for the sails of country boats."
TRUE,"On an average, £3,000,000 to £4,000,000 worth of wheat, about £i,000,000 worth of rye, and over £1,500,000 worth of barley are exported annually, besides oats, flax, linseed, rape seed, oilcake, bran, flour, vegetable oils, raw wool and caviare."
TRUE,"With a very few exceptions the speeches are dignified in tone, full of life and have at least a dramatic propriety, while of such incongruous and laboured absurdities as the speech which Dionysius puts into the mouth of Romulus, after the rape of the Sabine women, there are no instances in Livy."
TRUE,"Rape is grown in the marsh lands and flax on the east coast, while large quantities of apples and other fruit are raised near Altona for the Hamburg and English markets."
TRUE,"To increase the number of doubles, ewes are sometimes put on good fresh grass, rape or mustard a week before the tups go out - a ram to sixty ewes is a usual proportion, though with care a stud ram can be got to settle twice the number."
TRUE,"On the chest of Cypselus, Marpessa is represented as following Idas from the temple of Apollo (by whom, according to some, she had been carried off), and there was a painting by Polygnotus of the rape of the Leucippidae in the temple of the Dioscuri at Athens."
TRUE,The lowest specific gravity is owned by the oils belonging to the rape oil group - from 0.913 to 0.916.
TRUE,"The boiling out process cannot be applied to small seeds, such as linseed and rape seed."
TRUE,"The olive press, which was also used in the vineyards for expressing the grape juice, found its way from the south of France to the north, and was employed there for expressing poppy seed and rape seed."
TRUE,"It is true that on the continent extracted meal, especially rape meal from good Indian seed and palm kernel meal, are somewhat largely used as focd for cattle in admixture with press cakes, but in England no extracted meal is used for feeding cattle, but finds its proper use in manuring the land."
TRUE,"But the oils belonging to the rape oil group are characterized by considerably lower saponification values, viz."
TRUE,"In the case of those oils which do not belong to the rape oils and yet show abnormally low saponification values, the suspicion is raised at once that a certain amount of mineral oils (which do not absorb alkali and are therefore termed ""unsaponifiable"") has been admixed fraudulently."
TRUE,I thought there was no situation I couldn't handle outside of rape - and I didn't believe you would do that.
TRUE,"He was sent to jail, but only for the rape they could prove."
TRUE,"He found God, started a church and homeless shelter in Philadelphia, and confessed to every rape he'd committed."
TRUE,"I knew rape was power to the perpetrator so I vowed to be firm and possibly defiant, and not display fear."
TRUE,"Did he rape you, Lydia?"
TRUE,"The bastard was trying to rape me, for god's sake!"
TRUE,"She recalled her night with a jolt and sat, expecting men to leap from the shadows to rape her."
TRUE,"If he wanted to abort her, to rape her, he could have done it with impunity many times over."
TRUE,Rape and sexual assault that recurs is considered sexual abuse.
TRUE,"Rape and sexual assault are especially traumatic for children and adolescents, who often do not fully understand normal sexual activity."
TRUE,Similar statistics were gathered by the NCJJ regarding the perpetrators of rape and sexual assault.
TRUE,Many children and adolescents are reluctant to report rape and sexual assault for a number of reasons.
TRUE,"Unreported rape and sexual assault are especially common when the offender is known to the victim, such as a family member or respected member of the community (e.g., clergy, teacher)."
TRUE,"Rape and sexual assault are diagnosed by interviewing the patient and parents, physical and gynecological examination, and laboratory tests for the presence of seminal fluid."
TRUE,"In many cases, children or adolescents do not report the rape or sexual assault, but they do show obvious signs of physical violence."
TRUE,"When rape is suspected, diagnosis may be made by a psychiatrist or psychologist based on sessions with the victim."
TRUE,"In such cases, diagnosis of rape or sexual assault is revealed through therapy sessions for PTSD."
TRUE,Approximately 31 percent of rape victims develop PTSD as a result of their assault.
TRUE,"Because rape is a crime, there are certain requirements for medical evaluation of the patient and for record keeping."
TRUE,"After evidence is collected, rape victims are treated with appropriate medical care for their injuries."
TRUE,Children and adolescents who have been raped or sexually assaulted are three times more likely to experience another rape in adulthood.
TRUE,"For adolescents, untreated rape and sexual assault can result in serious long-term psychological effects."
TRUE,"Even when treated, rape and sexual assault can cause poor self-esteem, sexual dysfunction and impaired sexual and personal relations, insomnia, anxiety, eating disorders, and other psychological symptoms that last into adulthood."
TRUE,"Usually, rape and sexual assault cannot be prevented, and it is important that children and adolescents, who often think they are at fault after an attack, be told that there was nothing they could have done to prevent the attack."
TRUE,"Because rape and sexual assault cause long-term psychological trauma, parents should be aware of symptoms of PTSD, depression, substance abuse, high-risk behaviors, and anxiety in their children."
TRUE,Long-term therapy with a counselor experienced in rape and sexual assault trauma can benefit both the victim and parents.
TRUE,Parents should also be aware that PTSD and other psychological effects of rape can manifest as poor school performance.
TRUE,"Kawsar, M., et al. ""Prevalence of Sexually Transmitted Infections and Mental Health Needs of Female Child and Adolescent Survivors of Rape and Sexual Assault Attending a Specialist Clinic."""
TRUE,"Ruggiero, Kenneth J., et al. ""Is Disclosure of Childhood Rape Associated with Mental Health Outcome?"
TRUE,"Involuntary sexual intercourse such as rape and sexual abuse may occur more commonly among adolescents, especially younger adolescent women, and often pose a potential risk for acquisition of STDs."
TRUE,"He said he was a lawyer, an astronaut, a doctor… He would go on dates with women and put something in their drink, and rape them."
TRUE,"Regardless of the length of your relationship, forced sex is rape, end of story."
TRUE,"Known as date rape drugs, they have received plenty of media attention."
TRUE,"Remember, physical force is not necessary in a date rape situation."
TRUE,Simply the threat of violence or fear can lead to a date rape.
TRUE,"Once sexual penetration happens after the words ""no,"" it is rape - plain and simple."
TRUE,A recovering victim of any kind of rape situation needs continuing guidance to rebuild self esteem and trust.
TRUE,"This might have something to do with the rape, but not necessarily."
TRUE,"What this means is, should a girl and guy become intimate and the age difference between them is 5 years or more, the older person could be charged with statutory rape."
TRUE,You may prefer to call their helpline at 1-866-331-9474 or 1-866-331-8453 TTY.You may also want to contact a local domestic violence organization or rape crisis center in your area.
TRUE,"Other movies followed suit with high numbers including The Waltons' Thanksgiving Story in '73, Women in Chains in '72 and A Case of Rape in '74."
TRUE,Character studies set Days apart from the competition as the plot explored the fragile mental state of Marie Horton and the rape of Mickey Horton's wife Laura by his own brother Bill.
TRUE,Erica's child (a product of a rape when she was just 14 years old) debuted on the show in the mid 90s played by Sarah Michelle Gellar (who would earn an Emmy for her portrayal and would go on to play Buffy the Vampire Slayer).
TRUE,"While Bianca, Erica's younger daughter got her fair share of controversy (her coming out story, rape and later the birth of her daughter ), Kendall is the modern day Erica without as many wedding rings."
TRUE,"The rape, initially a spoil point for Laura's near perfect romance with her teenage husband Scotty, was eventually swept under the rug as the unique chemistry between the actors and the characters came to the forefront."
TRUE,When Roger Howarth played Todd Manning he refused to participate in passionate love scenes out of sensitivity to the fans of the show that met Manning when he led the gang rape of Marty Saybrook.
TRUE,"Todd's violent past on the show, including his participation in the date rape of Marty Saybrooke, left fans breathless with his range, so St John needed to fill big shoes."
TRUE,Nora's work as the district attorney landed Smith front and center as she participated in the prosecution of the Marty Saybrooke rape trial.
TRUE,"As its popularity grew, however, Hollyoaks began to tackle much more serious issues, such as incest, alcoholism, date rape, eating disorders and drugs, to name just a few."
TRUE,"Indeed, Coronation Street has seen its share of jaw-dropping storylines since its inception, ranging from kidnappings and gang violence to infidelity and rape."
TRUE,Marty's rape in the college dorm room put Kevin Buchanan in the hot seat and Todd Manning's reign of terror led to powerful leading man status.
TRUE,"Todd, the villain who led a gang rape of Marty, has been forced to come to grips with who he is and where he came from."
TRUE,Daughter Kendall is the product of a rape that occurred when Erica was just 14 years old.
TRUE,The first was a product of rape and the second was Zach donating sperm so that Bianca's children would share similar DNA.
TRUE,"In her 40 years on the series, Viki has struggled with rape, divorce, stroke, breast cancer, love, loss and widowhood."
TRUE,"In 1993, wild child Marty Saybrooke was the victim of a brutal gang rape in a college dorm room."
TRUE,Among some of the great storylines was a revisit to Laura's rape in 1999 when son Lucky learned of it.
TRUE,My husband would never rape me.
TRUE,The neighboring kingdoms rape and abort even their own!
TRUE,I'm not going to rape you.
TRUE,You can't rape a willing soul.
TRUE,"When he holds you down to do it, that indicates a potential for rape."
TRUE,"In fact, I'm actually considering putting our entire rape acreage down to the variety for the coming season."
TRUE,"The GM beet was tolerant to glyphosate, the GM maize and oilseed rape were tolerant to glufosinate ammonium."
TRUE,She presented a paper and poster on assessment of resistance to light leaf spot and stem canker in oilseed rape cultivars.
TRUE,"They rape any female chimp they come across, murder her baby, form a gang to go hunting monkeys."
TRUE,"Pain Shared Rape does not just hurt the child and family, but also the child's classmates."
TRUE,"Asked whether or not the GM contaminated oilseed rape crops should be destroyed, 93% said yes, 7% said no."
TRUE,This was 80 times the separation distances used for crop trials of GM oilseed rape in the UK.
TRUE,"One scene featured the song "" Do you want to be in my gang, my gang, my gang rape "" ."
TRUE,Evidence for GM oilseed rape suggests that gene flow to wild relatives is very rare and that hybrids do not establish in the wild.
TRUE,Among the crops were GM oilseed rape varieties used to produce F1 hybrids belonging to AgrEvo UK (now Aventis ).
