Category,Message
FALSE,"Whether it is his mild manner, inquisitive ways or infectious laugh, toddlers are attracted to Elmo."
FALSE,"However, the men who do so in the parades usually only dress that way for a laugh once a year."
FALSE,Dilbert of the eponymous comic strip first popularized them (or not) and they have gained new laugh power as the wardrobe of uber-dweeb Dwight on the TV show The Office.
FALSE,"When you wear cool designs on T shirts, you can make people laugh, inspire a stranger to strike up a conversation with you, or just get a nod of approval in response to the art you've chosen or the witty quip across your chest."
FALSE,Toni asked with a laugh.
FALSE,A smile flickered across his face and turned into a laugh.
FALSE,She gave a startled laugh.
FALSE,He'd laugh at you.
FALSE,His laugh was sardonic.
FALSE,His laugh was short.
FALSE,"When the ambassadors of the senate in treating for peace tried to terrify him with their hints of what the despairing citizens might accomplish, he gave with a laugh his celebrated answer, ""The thicker the hay, the easier mowed!"""
FALSE,His laugh was more a snort.
FALSE,"What about if you sneeze, cough or laugh?"
FALSE,"Occasionally she broke out into a merry laugh, and then she would reach out and touch the mouth of any one who happened to be near her, to see if he were laughing also."
FALSE,"Suddenly, Joanna 's ladylike features, which have been looking benignly tranquil, wrestle heroically and hilariously with the urge to laugh."
FALSE,So just laugh and ignore the friend who keeps teasing you!
FALSE,"When a smile isn't enough, send a hearty laugh."
FALSE,Limousine passengers can laugh and talk without having to worry about being distracted while driving.
FALSE,We started to find humor in our situation and laugh at the craziness of it.
FALSE,This will give the bride and groom a good laugh when they open it.
FALSE,"Michael Richards' comedy set at the Laugh Factory started innocently enough on Friday, November 17."
FALSE,Check out this blog to get a good laugh at Hollywood's most fashion-challenged celebs.
FALSE,"She has made us laugh, cry and even dance in front of our television sets (when no one was looking, of course)."
FALSE,"She was ""discovered"" during a Laugh Factory kids' comedy showcase when a Nickelodeon executive spotted her performance."
FALSE,"Rogen is said to have been inspired by Adam Sandler's comedy album, They're All Gonna Laugh at You!, calling it the funniest thing he's ever heard."
FALSE,"So, when those players in the commercial retire from football and their abs get flabby and their hard muscles transform in to soft flab, maybe someone should point and laugh at them."
FALSE,It wasn't long before he was making international audiences laugh through his stand-up comedy and acting.
FALSE,"When he was eight years old, his mother suffered from rheumatic fever, and he spent lots of time trying to make her laugh."
FALSE,Perhaps this is why a student can laugh at a poop joke on Family Guy and then turn to the biting political satire of The Daily Show.
FALSE,"Remember, the idea is to make them laugh and not to frustrate."
FALSE,Playing computer pranks can be a fun way to share a laugh with someone who will appreciate the joke.
FALSE,"Harmless April Fool's Day pranks and practical jokes are a way to have fun and share a good laugh with family, friends and coworkers."
FALSE,Share a laugh with the person by showing them your piece of fabric and ripping it right in front of them and then plan who you can tempt with the dollar bill on the floor next!
FALSE,"If you want to have fun and enjoy a good laugh with people you know, consider playing funny pranks on each other."
FALSE,"Make sure that your intended victim will think that your actions are all in good fun and laugh with you, as opposed to getting angry."
FALSE,Adding some gummy worms to a person's lunch is a way to get a good laugh in the middle of the day.
FALSE,"Take a break, have a laugh, and learn about more sites that are resourceful all at the same time!"
FALSE,"They are given for the fast, hard laugh and as soon forgotten, such as the cut noose - representing cutting ties with corporate jobs."
FALSE,Games give residents the opportunity to laugh and share their laughter.
FALSE,"If he has a great sense of humor, a gift to make him laugh is appropriate, but if he is more of a serious intellectual, then that may not be the route to go."
FALSE,"He would laugh, or say such things as ""You will die, mortal!"" and ""Was that your best?"""
FALSE,"Many couples find it challenging at first, and you may laugh or experience some initial unease."
FALSE,"Dusty's not allowed out of his room without her—"" ""Darian!"" she said with a laugh."
FALSE,"Bianca coughed to cover her laugh, and Pierre seconded the vamp with a quiet amen."
FALSE,She coughed to cover her startled laugh.
FALSE,"He'll be inconsolable, Linda said with a delighted laugh."
FALSE,"He's got a great sense of style, Linda said with a laugh."
FALSE,"She smiled, and Traci covered her mouth to keep him from hearing her laugh."
FALSE,Deidre gave an unsettled laugh.
FALSE,"This time, Gabriel did laugh."
FALSE,Cora coughed to cover up her laugh.
FALSE,Gabriel asked with a bitter laugh.
FALSE,Deidre stared at her then gave a startled laugh.
FALSE,I like having the last laugh.
FALSE,How is that for her having the last laugh?
FALSE,"Rhyn growled a painful laugh, appreciative of the death dealer's dark humor."
FALSE,"Probably just some bum, the brunette driver said with a forced laugh."
FALSE,"There was a moment of silence, then a child's gleeful laugh."
FALSE,Rhyn asked with a laugh.
FALSE,He cut off the conversation with a hearty laugh.
FALSE,"They all had a good laugh over that too, all but Dean."
FALSE,"Randy has been so good about it—so encour­aging, but even so—I feel like it's a sin to smile, or laugh."
FALSE,"Someone would laugh and it would remind him of her laugh, turn their head to the side and it would be the way she always moved."
FALSE,Alex's laugh was short and humorless.
FALSE,His laugh was short and strained.
FALSE,Katie's laugh followed her.
FALSE,Katie's laugh was humorless.
FALSE,His short laugh was more a snort.
FALSE,"Never again would she be startled by his sudden appearance in the garden, nor laugh at his gentle frolicking with the twins."
FALSE,"They all had their laugh, but to Carmen it wasn't that funny."
FALSE,Gerald's eyes reflected humor and his breath came out in a sudden rush that barely resembled a laugh.
FALSE,She started to laugh and then realized it wasn't Alex who had caught her.
FALSE,Denton's laugh was harsh.
FALSE,He barked a laugh.
FALSE,Darian asked with a laugh.
FALSE,Xander asked with a laugh.
FALSE,It made her want to laugh and squirm uncomfortably.
FALSE,She soon heard Toni's high-pitched laugh as the woman started the interview with Xander.
FALSE,Jessi started to laugh then realized the handsome man was serious.
FALSE,Jessi stifled a laugh.
FALSE,It was almost as arresting as her sweet scent and the shocked look on her face that made him want to laugh.
FALSE,"She wanted to laugh but didn't, aware he was as vulnerable as he'd ever get right now."
FALSE,"In public he maintained a bearing of rigid solemnity, and was seen to laugh only three times in the course of his life."
FALSE,"Voltaire never dwells too long on this point, stays to laugh at what he has said, elucidates or comments on his own jokes, guffaws over them or exaggerates their form."
FALSE,"And his popular works, the Adagia, and the Colloquia (1524), had established themselves as standard books in the more easy going age, when power, secure in its unchallenged strength, could afford to laugh with the laughers at itself."
FALSE,"His vanity, however, as has been admirably remarked, is essentially that of "" the peacock, not of the gander,"" and is redeemed by his willingness to raise a laugh at his own expense (Strachan-Davidson, p. 192)."
FALSE,"The officers were called to meet at Newburgh, and it was the avowed purpose of the leaders of the movement to march the army westward, appropriate vacant public lands as part compensation for arrears of pay, leave Congress to negotiate for peace without an army, and ""mock at their calamity and laugh when their fear cometh."""
FALSE,"The Muses carried off the second prize in 405, Aristophanes being first with the Frogs, in which he accuses Phrynichus of employing vulgar tricks to raise a laugh, of plagiarism and bad versification."
FALSE,"Malatesta could afford to laugh at this farce, but he nevertheless prepared in haste for a desperate defence (1462)."
FALSE,I laugh at her ignorance and she'll suffer for it.
FALSE,"Bianca stifled a laugh, genuinely liking the subtle yet feisty Oracle."
FALSE,"Talon stood and threw his head back in a booming laugh of triumph, until Dusty launched at him and knocked him off his feet."
FALSE,"Dusty's not allowed out of his room without herâ€”"" ""Darian!"" she said with a laugh."
FALSE,"Jule, the regional commander of the eastern hemisphere, demanded with a laugh."
FALSE,His irritated honesty startled her enough that she started to laugh.
FALSE,Past-Death gave a startled laugh.
FALSE,"Fitzgerald left with a laugh, leaving the box of bones smack dab in the middle of the scrapping, snarling Dawkins, none of who gave a lick about the plastic anatomical remains."
FALSE,"Laugh all you will, Rhyn, but this is my home, and the refuge of our Immortal brethren."
FALSE,"Then there were voices, Gladys with a shrill laugh, than hushed giggling, a stumble on the steps, a grunt and finally silence."
FALSE,Her laugh echoed down the rocky canyons of Zzz as the essence of abomination breathed his bloody last below her.
FALSE,After he influenced her he would ask her to laugh againâ€¦and again.
FALSE,"Kris's memories stirred stronger than he liked.  He remembered Lilith, a beautiful Immortal whose laugh had filled him with happiness.  Their love had been intense and brief, lasting less than a human year in total.  One day, she was just â€¦ gone.  Slaughtered by Rhyn, who had taken her head the same way his brothers took the head of Rhyn's demoness mother."
FALSE,"Randy has been so good about itâ€”so encour­aging, but even soâ€”I feel like it's a sin to smile, or laugh."
FALSE,"Toni's face lit up, and she thrust out her chest in a way that made Jessi want to laugh in embarrassment on the oblivious model's behalf."
FALSE,"He would not even condescend to make a baby laugh if nobody else laughed, or even listened."
FALSE,"Hi again everyone, Janine, I had to laugh, congrats on the hairy armpits - crazy or what?"
FALSE,Both he and SuleymÃ¢n appeared to think that atheism was a subject to make angels laugh.
FALSE,"Just like Dr. Evil and other baddies, he gets yes men around him who will laugh at his mocking."
FALSE,"Laugh your head off, maybe even blink back a tear."
FALSE,"They laugh when we pick the legs and heads off the prawns, instead just chomping them down whole."
FALSE,He would laugh at the thought of an ancient curse controlling his destiny.
FALSE,Even the most deluded of deluded optimistic naÃ¯ve fools on LSD would laugh at that suggestion.
FALSE,"With Leicester getting desperate, we could finally laugh at them."
FALSE,"His friends looked indignant, which only caused him to laugh even harder."
FALSE,"In the workplace men, and women now, are expected to laugh at dirty jokes, and even tell dirty jokes."
FALSE,Post the latest funny SMS jokes here for all to laugh at.
FALSE,"Aye no problem "" [laugh] and I'm like "" No, I'll have a latte please, actually."
FALSE,"She looked at it and coughed, tho it could have been a stifled laugh."
FALSE,John's infectious laugh made everyone feel that he was nothing more than a mate playing a few tunes for you.
FALSE,I hide away and I hear a hollow laugh.
FALSE,A woman in tonight's audience had a laugh like a hyena and she laugh like a hyena and she laughed all the time.
FALSE,"With an insane laugh, TIM released the girl from his grip and she fell lifeless to the ground at Liz ' feet."
FALSE,Meanwhile Mrs Urquhart arrived for our missing luggage and we all had a good laugh!
FALSE,The kids get a good laugh at Samantha's old mom struggling to reach down and grab the block for a good start.
FALSE,"All you can do is laugh and there are some cracking one-liners, delivered by actors who don't understand comic timing."
FALSE,And it makes me laugh especially that somebody like you with all your patriotic piffle likes a film like Braveheart.
FALSE,"However, funny love poems can be good for a laugh."
FALSE,"He had the best quips... "" She said, a small laugh sliding out from her last word."
FALSE,It's down to you to decide whether you're up for a laugh or want to get raunchy.
FALSE,I have vivid memories of being severely reprimanded by my head teacher for making my class laugh too much.
FALSE,"Sending him breakfast was intended as a gentle ribbing, the sort of thing two friends who knew each other well could laugh about."
FALSE,"It shows in your way of frying sausages, don't laugh."
FALSE,She had great scorn for the notion that one should be able to laugh at oneself.
FALSE,They do not laugh so much and seem more sinister.
FALSE,"There were scenes in there that were pure slapstick, that made me laugh harder and harder as the scene developed."
FALSE,I can still see that evil smirk setting his whiskers a-quiver; I can almost hear that snide little kitty laugh.
FALSE,I laugh at any poor sucker who decides to waste their time on this map.
FALSE,"Marvel as they brave a thunderstorm for your listening pleasure, and laugh as they run out of things to say at the end."
FALSE,"Suddenly, Joanna's ladylike features, which have been looking benignly tranquil, wrestle heroically and hilariously with the urge to laugh."
FALSE,"She was sitting bolt upright with her jaw set in a tight line, desperately trying not to laugh."
FALSE,"Mouse makes you laugh, he's so vicious."
FALSE,Her vocal powers also include a wonderfully wicked laugh.
FALSE,"For a laugh, I did buy a red, curly wig which Andy remembers being orange."
FALSE,"Just laugh at yourself, then try to remember why you do yoga in the first place."
FALSE,"I work as well as I sleep, he added, with a laugh."
FALSE,"But why, after displaying so much cunning, did he invariably betray himself the moment he came up by that loud laugh?"
FALSE,The princess as usual spoke smilingly and listened with a laugh.
FALSE,Escaping from her father she ran to hide her flushed face in the lace of her mother's mantilla--not paying the least attention to her severe remark--and began to laugh.
FALSE,Boris did not laugh.
FALSE,"She smiled, hid her face in her handkerchief, and remained with it hidden for awhile; then looking up and seeing Pierre she again began to laugh."
FALSE,The prince again laughed his frigid laugh.
FALSE,He signed with a flourish and suddenly turning to his son began to laugh.
FALSE,"He seized his son by the hand with small bony fingers, shook it, looked straight into his son's face with keen eyes which seemed to see through him, and again laughed his frigid laugh."
FALSE,Denisov began to laugh.
FALSE,"Eh? said Anatole, with a good-humored laugh."
FALSE,He lifted his head high and gazed at Denisov as if repressing a laugh.
FALSE,"He had the best quips... She said, a small laugh sliding out from her last word."
FALSE,She just rants away at him and the situation is so bizarre nobody can do anything but laugh.
FALSE,A short pause is followed by a raucous laugh.
FALSE,It 's down to you to decide whether you 're up for a laugh or want to get raunchy.
FALSE,You heard their ribald laugh as they clutched the moving bag that the Count threw to them.
FALSE,Love sarah P.s. My Pc name is even Howl MC which makes the people at aol laugh when I have to call up !
FALSE,"It made him laugh, and he scoffed at the people and called them cowards and old women."
FALSE,We laugh to scorn the very idea of exam revision.
FALSE,"All comments are welcome, gives me something to laugh at while im skiving at work !"
FALSE,"Women Do you ever pass urine when you sneeze, cough or laugh?"
FALSE,If I was more of a musical snob or NME hack I 'd laugh at this and give it a virtual kicking.
FALSE,Sometimes people sound like they 're sobbing when they try to laugh.
FALSE,Maddy made me laugh (with gritted teeth) today.
FALSE,Gary Little made a triumphant return to the Just Laugh stage.
FALSE,I mean to shew her that I only laugh at her uncivil behavior.
FALSE,"Mouse makes you laugh, he 's so vicious."
FALSE,"Just sit back, relax, and get ready to laugh out loud at all of Stephanie 's wacky adventures !"
FALSE,"Remembering their youthful attempts at playing songs in waltz time, McLennan ca n't suppress a laugh."
FALSE,Stewart 's school yearbook entry paid tribute to his ability to make other pupils laugh.
FALSE,She didn't know whether to laugh or cry when the baby covered himself with his lunch.
FALSE,"With reference to an old story, Tessa was able to make the whole room laugh."
FALSE,A coquettish laugh escaped the mouth of the young girl trying to earn the attention of Matt.
FALSE,"Christy would feign a laugh every time her boyfriend made a joke, no matter how funny it was."
FALSE,Dave is one of the funniest people I know. He always makes me laugh.
FALSE,The professor was disappointed that his students did not laugh at his clever pun.
FALSE,"She let out a short, derisive laugh when she heard the latest news from her gossiping friends."
FALSE,"Don't take it personally when you get called a noob by the more experienced players, just try to laugh it off."
FALSE,"The Fisher-Price classic Corn Popper is perfect for kids ages 1 to 3, as is the Laugh and Learn Learning Mower."
FALSE,Laugh together with him when the baby just can't seem to get it.
FALSE,"We know the meaning behind every burp and sigh, laugh and cry."
FALSE,"When she is a teen, you'll laugh about it together!"
FALSE,"Play and laugh together, taking the opportunity to learn about your baby's new arrangement, thus relieving your fears and ensuring the child will build trust with the new caregiver."
FALSE,"In Mary Had a Little Lamb, what made the children laugh and play?"
FALSE,And now when every new baby is born its first laugh becomes a fairy.
FALSE,Don't be afraid to be silly and laugh with your children.
FALSE,"Simple personalized pacifiers can bear your baby's name or nickname, a word or phrase that makes you laugh, or they may even be part of a personalized gift set that includes a personalized onesie and pacifier."
FALSE,"Some funny pacifiers are even designed to look like your baby has a full set of crooked teeth, big red lips and other such gags to make you laugh."
FALSE,"By six months, he should gurgle, laugh, babble repetitive sounds and attempt to imitate them, look for the source of sounds such as a parent's voice and begin to pay attention to music."
FALSE,Laugh & Learn Learning About Opposites - Help your child understand the concept of opposites.
FALSE,"While some of these items may not be practical for every day use, they can be good for a laugh and some entertainment."
FALSE,His goal was to create a book that made people laugh.
FALSE,"Impress your friends by imparting the 150-year history of Cointreau over drinks, and laugh at them when they pronounce it ""coin-TRUE""."
FALSE,Laugh - Teach kids the importance of humor by poking gentle fun at them and encourage them to do the same to you.
FALSE,"Being able to laugh at yourself is a great gift that promotes compassion, communication and understanding."
FALSE,"Try some of these home activities and games that keep hands busy and provide the opportunity to talk, share and laugh."
FALSE,"Perfect if you are looking to include a quote like Sit Long, Talk Much, Laugh Often in your home."
FALSE,"When you ask an emo how to get the ""emo look,"" chances are they will laugh at you and tell you that anyone who is ""trying"" to be emo is not a genuine member of this elite group of social dramatics."
FALSE,An increase in laugh lines and crows feet can also cause concern when applying makeup.
FALSE,"You done left your fingerprints."" It wasn't so much what Dodson said, but the hilariously exaggerated manner in which he said it that made people laugh."
FALSE,"If something goes wrong on your date, try to laugh it off."
FALSE,Do you laugh at how much your style has changed?
TRUE,I have a special mission for you.
TRUE,I can't have you distract me from my mission right now.
TRUE,"He failed in his mission, for which she was grateful."
TRUE,Its mission statement is to demand transparency after a crime is committed and to assure all efforts to nail the guilty party are being pursued.
TRUE,I have a real mission to execute hunting down insurgents.
TRUE,"You're fine now, and it's time for me to move onto the next mission, she insisted."
TRUE,Suppose Alfred Nota and his pal Homer's break-in at Collingswood Avenue was just a cover-up and their true mission was to plant a listening device.
TRUE,"In September 1791, Roland's mission being executed, they returned to Lyons."
TRUE,It never sat well with him that those charged with enforcing Death's mission served not out of choice but obligation to the deity that stole their souls.
TRUE,"For now, our mission is to protect the lost souls from the demons."
TRUE,The radio channel played nonsensical songs from the 60's in a barely successful mission to lift her spirits.
TRUE,"To an outsider, he appeared as confident and fresh as a man just starting a mission after a good night's sleep."
TRUE,You and I have a different mission.
TRUE,I'm going on a mission.
TRUE,This started out as a mission about us but has turned into a mission about you.
TRUE,"Descartes accepted the philosophic mission, and in the spring of 1629 he settled in Holland."
TRUE,"On his visit to Toulouse in 1665, with a mission from the Cartesian chiefs, his lectures excited boundless interest; ladies threw themselves with zeal and ability into the study of philosophy; and Regis himself .was made the guest of the civic corporation."
TRUE,"Jellia at once departed on the errand, and she was gone so long that they had almost forgotten her mission when the green robed maiden returned with a troubled face."
TRUE,"It has several ginning factories and a cotton-mill; two high schools, one maintained by the Government and the other by the Basel German Mission."
TRUE,I want you to get your things and meet me at the mission.
TRUE,She really had personalized the mission.
TRUE,What she didn't understand was why a vamp would consider it his job to remind her of her mission.
TRUE,Promise you'll barter my freedom if Qatwali imprisons me on this peace mission.
TRUE,"Wondering how much he should say, A'Ran's gaze went to another screen first, the one listing the details of their unsuccessful peace mission."
TRUE,"Kaisarieh is the headquarters of the American mission in Cappadocia, which has several churches and schools for boys and girls and does splendid medical work."
TRUE,"In 1837 the membership in Great Britain and Ireland was 318,716; in foreign mission stations, 66,007; in Upper Canada, 14,000; while the American Conferences had charge of 650,678 members."
TRUE,"The delegates found the king at Jedburgh, and the mission, which was a dangerous one, was successfully accomplished."
TRUE,He was appointed secretary to Cabarrus on a special mission to France in 1787.
TRUE,"During Somerset's protectorate he entered public life and was made a secretary of state, being sent on an important diplomatic mission to Brussels."
TRUE,"It consists of delegates elected by each province, certain ex officio members, and representatives from the mission field."
TRUE,Three years later this mission had to be abandoned; but in 1881 work was again resumed.
TRUE,"In 1856 John Coleridge Patteson, afterwards bishop of Melanesia, had paid his first visit to the islands, and native teachers trained at the Melanesian mission college subsequently 'established themselves there."
TRUE,"I was sent to train him, and I will complete my mission."
TRUE,"On a mission to ensure there was a clean slate between his mate and Darkyn, Gabriel waited in the middle of Deidre's old apartment for the Dark One to arrive."
TRUE,Brady's focus returned to his mission.
TRUE,Your team is being dispatched on a new mission.
TRUE,When's the next mission to the Peak?
TRUE,Brady forced his thoughts to his mission.
TRUE,It's an important mission.
TRUE,We both know this is a suicide mission.
TRUE,Are you really going to let your jackass brother send you on a suicide mission?
TRUE,This one had taken over Gabriel's mission.
TRUE,Just the lone Guardian whose mission there was as hidden to the boy-god as the Original Being's.
TRUE,I can't let my emotions interfere with a mission.
TRUE,She'd never let fear stand between her and a mission.
TRUE,"She couldn't let it stop her now, though this kind of fear was far different than that of losing her life or failure on a mission."
TRUE,Alex urged Ed into a walk and they continued their mission.
TRUE,How many times had she been told this was a fool's mission?
TRUE,"The infallibility of the Church, thus limited, is a necessary outcome of the fundamental conception of the Catholic Church and its mission."
TRUE,"About 1350 she went to Rome, partly to obtain from the pope the authorization of the new order, partly in pursuance of her self-imposed mission to elevate the moral tone of the age."
