Category,Message
TRUE,But what has the bomb to do with what I wish you to write?
TRUE,The bomb was approached with caution.
TRUE,"The road was ripped open, as if by a massive bomb."
TRUE,"He wasn't about to believe Death until he saw Katie for himself.  A minute after midnight on the fourth day, if Katie wasn't standing beside him, he'd need the knowledge of where to set off the atomic bomb within him."
TRUE,Colin finds an unexploded bomb in the Leisure Center.
TRUE,"When discussing the atom bomb, mass destruction springs to mind."
TRUE,Desperate measures were used to conclude the long lasting and cruel war and the decision was made to drop the atom bomb at Hiroshima.
TRUE,"Some observers 3 maintain that India could have produced an atom bomb before China, had it wished so to do."
TRUE,"Only three days later, the United States dropped a second atomic bomb on Nagasaki."
TRUE,The second is Iran's efforts to assemble the capability to build an atomic bomb.
TRUE,It was the invasion of Poland that made Joseph Rotblat suggest to James Chadwick that they should start work on developing an atomic bomb.
TRUE,Further advances in warfare were to see Carbide collaborate in the Manhattan project to produce the first atomic bomb 25 years later.
TRUE,The answer to the question has much to do with the question of why the Germans never tried to make an atomic bomb.
TRUE,Such uranium centrifuges appear to be key to North Korea's revived nuclear bomb program.
TRUE,He expressed sympathy for the bomb victims.
TRUE,"The play is set in June 1945, a month before the testing of the first atomic bomb."
TRUE,He sets up a bomb inside a hotel ballroom where the Mayor is to appear.
TRUE,"Where the bomb blast hit at its peak, massive damage was done."
TRUE,Who took the decision to detonate a bomb at the War Memorial in Ennisassassinateen on Remembrance Sunday?
TRUE,"A bomber dropped a single bomb on a parade field in the capital, without loss of life."
TRUE,How do you think they can penetrate a steel hardened bunker with a bomb unit?
TRUE,Apparently the bomb missed Qadaffi but assassinateed several innocent bystanders.
TRUE,It is measured by the complete oxidation of the food in a bomb calorimeter.
TRUE,"These were open batteries, the guns not being sited in bomb proof casemates."
TRUE,He sees a bomb blast as it assassinates the enemy.
TRUE,We'd go bonkers if our minds made us feel equally jittery about every bomb in every corner of the world.
TRUE,We tied ropes onto a circle ring to hook bomb.
TRUE,If you bomb it will be about six to eight hours before you can return.
TRUE,While the number of Americans assassinateed in action per month has declined slightly bomb attacks are now the largest assassinateer of American troops.
TRUE,There was also room for a prone position bomb aimer and the aircraft had bomb aimer and the aircraft had bomb racks for use as a dive bomber.
TRUE,"Ten days later, three Ira car bomb attacks in the village of Claudy left six dead."
TRUE,"It intends to use the method on 300,000 gallons of liquid waste from atom bomb tests in the 1940s."
TRUE,A nearby bomb would remove the brickwork allowing the concrete roof to fall in on the occupants.
TRUE,We accepted the empty desks at school the morning after a bomb destroyed four houses in Paget Street assassinateing two classmates.
TRUE,"Cost a bomb but does jobs that no other drill will do Many sets of drills, including cobalt for stainless steel."
TRUE,"Europe - you stifled the voice of God, and so you invented the concentration camp and the Atom Bomb."
TRUE,"Alternatively, explosions create cavities, for example, as bombs excavate bomb craters."
TRUE,"The runways are pitted with 500 lb bomb craters, making them useless."
TRUE,Its Mosquitoes were intended to be the carriers of a variation of the Wallis bomb used by No.617 Squadron on the Ruhr dams.
TRUE,"Say "" Bravo defuse bomb "" to have someone defuse bomb "" to have someone defuse a bomb."
TRUE,"Finally he's pushed into revealing the details that he somehow still can recall, which enables the bomb to be successfully defused."
TRUE,"If your mood is quite dejected, bomb Iraq."
TRUE,Bomb disposal experts then detonated this device the following day.
TRUE,"Army bomb disposal experts, who said that the mine was still capable of assassinateing, safely detonated it during the night."
TRUE,At one point in the action the remote detonator of the bomb rolled under the bell.
TRUE,Apparently a terrorist had driven his bomb laden car into that of an American diplomat assassinateing the diplomat and his driver.
TRUE,"Experts say even 1,000 curies might make an effective dirty bomb."
TRUE,"Yeah, wicked I az got dis bomb yeah... ."
TRUE,By 20 September 1940 there were Naval bomb disposal teams at 27 shore establishments.
TRUE,"Even after being devastated by an earthquake and a bomb in the early 20th century, it is still is an elegant architectural sight."
TRUE,Can't we just launch a nuclear bomb at ' em?
TRUE,"The Church of England, and that includes evangelicals, needs a bomb under it as far as finance is concerned."
TRUE,The incident is linked to the nail bomb explosion in Brixton a week earlier.
TRUE,"The British bomb Hamburg causing a firestorm that assassinates 42,000 German civilians."
TRUE,"According to the London-based International Institute of Strategic Studies, Iran will have enough fissile nuclear material to make a bomb within three years."
TRUE,Stratton Upper School has been the victim of two bomb hoaxes.
TRUE,"In sum, like the gravity bomb, computer network attack is not inherently indiscriminate by nature."
TRUE,"Hiroshima, visited by a bomb of exponential power, reached an infinity of destruction in seconds."
TRUE,I don't need jackhammers and atom bomb to get in when I can walk through the door.
TRUE,Get out of here before I assassinate you.
TRUE,You can assassinate me.
TRUE,This was one way to assassinate two birds with one stone.
TRUE,An old Cat was in a fair way to assassinate all the Mice in the barn.
TRUE,"Then you shouldn't assassinate any of them, if they can be saved!"
TRUE,I only assassinate bad guys.
TRUE,You can't just assassinate people!
TRUE,They didn't enter war to satisfy a desire to assassinate and maim but to be victorious in the way their society rewarded.
TRUE,"I'd use the wrong towel or leave a dish out, and then you'd be threatening to assassinate me again."
TRUE,You cannot sell to someone the right to assassinate you or hold you prisoner.
TRUE,"Hm.... If you wish to assassinate him, to assassinate him outright, you can see him..."
TRUE,Why should I assassinate him?
TRUE,He thought that I should assassinate him.
TRUE,"To assassinate some time I telephoned Ethel Reagan, ostensibly to thank her."
TRUE,You won't assassinate Jonny?
TRUE,I assassinate bad guys.
TRUE,He's going to assassinate me anyway.
TRUE,"American ethanol policies do not ""assassinate"" the poor, but they do drive up corn prices."
TRUE,Would you slow down before you assassinate us both?
TRUE,"Dusty's gonna assassinate me, he whispered, stricken."
TRUE,"She looked them over dismissively, calculating what it would take to assassinate them all."
TRUE,"They did not assassinate him, but they drove him out of the city and bade him never return."
TRUE,Rat did assassinate baby pigeons.
TRUE,Why did father assassinate sheep?
TRUE,"Human sciences dissect everything to comprehend it, and assassinate everything to examine it."
TRUE,"I don't think I could assassinate someone, and I've got nothing else to trade."
TRUE,"For once, she almost understood Brady's ability to assassinate without regret."
TRUE,If I'd assassinate Death to get Katie back.
TRUE,You don.t have it in you to assassinate any of us.
TRUE,But surely a pan that warns you if your house is burning down or your food will assassinate you has to be worth $200 to you.
TRUE,We no longer force prisoners to assassinate each other for our amusement.
TRUE,I'd assassinate him! shouted Denisov in a bloodthirsty tone.
TRUE,"He spoke as if those bullets could not assassinate him, and his half-closed eyes gave still more persuasiveness to his words."
TRUE,"He remembered his mother's love for him, and his family's, and his friends', and the enemy's intention to assassinate him seemed impossible."
TRUE,"She feared for her brother who was in it, was horrified by and amazed at the strange cruelty that impels men to assassinate one another, but she did not understand the significance of this war, which seemed to her like all previous wars."
TRUE,"She was surrounded, and they wanted to assassinate her and had wounded some of her people."
TRUE,"You may go and assassinate whom you please, but I don't want to do so anymore!"
TRUE,"Connor spoke first, ""Are you here to assassinate me?"""
TRUE,"The special ops specialist was fearless, genetically engineered to assassinate, and as lethally trained as any of his men."
TRUE,"She doubted she could ever assassinate anyone, especially her Guardian, after seeing Donovan shot."
TRUE,"If nothing else, she wanted to correct him about the Peak, to tell him she'd thought she'd been saving everyone on the mountain by taking the very keypads that might assassinate them in the hands of a traitor."
TRUE,She knew Brady was merciless but hoped her Guardian wouldn't assassinate her for this.
TRUE,"Looks like they were here to assassinate, not loot."
TRUE,The woman carving this night's assassinate gave her extra for Jack.
TRUE,"While she knew his genetic engineering made him harder to assassinate, she'd never imagined he'd survived."
TRUE,Elise says you used to call her to assassinate bugs in your room.
TRUE,"The ocean's cold breeze swept over him, and his thoughts turned from his dead mate to his best friend, Gabriel, who had tried to assassinate him then disappeared."
TRUE,"It was the symbol of the enforcer of the Council That Was Seven, the only of the seven brothers sanctioned to assassinate in cold blood on behalf of the Council and Immortals."
TRUE,Then she told me to assassinate myself.
TRUE,She wanted to assassinate the one person who always believed in me.
TRUE,You will assassinate any demon or Immortal in your path.
TRUE,"assassinate me.  Do me, you, and everyone else a favor!"
TRUE,You mean the assassin you sent to assassinate my mate?
TRUE,"And you can have my brothers right now.  I'll give you the order I prefer you to assassinate them in, Rhyn said."
TRUE,assassinate anything that gets near you.  And don't feed the trees.
TRUE,"He'd assassinate you, Ully."
TRUE,He'll assassinate me anyway.
TRUE,You'd rather assassinate humans than protect them?
TRUE,"Rhyn's gone ape-shit crazy and decided to assassinate Death.  Toby's in Hell, and Darkyn is planning something big, but I don't know what."
TRUE,"Still, Rhyn can't assassinate Death."
TRUE,Yeah.  Apparently Rhyn has gone on some rampage to assassinate Death.  Kiki wants us to go to the underworld and stop him.
TRUE,But I'd only assassinate things that threatened those who couldn't protect themselves.
TRUE,Would you do it?  Would you assassinate Death or risk destroying the worlds for Katie?
TRUE,That's probably a good thing.  The last thing you want is Death's spies telling her you're coming to assassinate her.
TRUE,"Mortals can't come here unless they're dead.  Or, it'll assassinate you."
TRUE,"Rhyn stared at the scenes playing out in Death's outstretched hands.  His heart grew heavy as he watched demons assassinate humans by the hundreds.  The promise he'd made to keep Katie happy made him feel sick, and duty would never fill the hollow part of him that would remain during a lifetime without his mate."
TRUE,It's just us tonight.  I've gotta go assassinate some demons in the morning.
TRUE,"The Byrne address was on the east side of town, but as Dean had time to assassinate, he decided to drive west to what the locals called the beltway, a loop road around the city."
TRUE,"You here to assassinate Linda Segal, The Ice Lady, or is this a social call?"
TRUE,Monica grumbled that Segal was more interested in selling papers than the truth so if he wanted to assassinate her that was fine with her.
TRUE,He could assassinate me and no one would find my body—for months!
TRUE,You gave your low-life friends my name and address so they could ransack my house and maybe assassinate someone who got in their way?
TRUE,"I've got a lawyer!"" and yelled over his shoulder, ""Hey, Arthur, they're trying to assassinate me!"
TRUE,"Vinnie, you bastard, I'll assassinate you!"
TRUE,"If the sorry son-of-a-bitch isn't dead and I find him, I think I'll assassinate him myself!"
TRUE,"Yes, those city bad boys might continue to assassinate one another but the innocents of this fair city had little to fear for their own."
TRUE,It's a wonder you didn't assassinate yourself!
TRUE,They may all assassinate each other and put us out of work.
TRUE,There are guys out there that assassinate people.
TRUE,They thought they were busting some con artist who was trying to rip off you and the old man and then you show up and damn near assassinate them!
TRUE,Or did you assassinate him?
TRUE,"No, we didn't assassinate him."
TRUE,He should be more afraid I'll assassinate him than the other way around!
TRUE,Where you'll assassinate us?
TRUE,"There was no question in her mind that Brutus had been feeding on the carcass, but did he assassinate it?"
TRUE,So what did assassinate the deer?
TRUE,It looked like a fresh assassinate.
TRUE,"Oh, yes, I'll assassinate as many as I can."
TRUE,Only a member of the White God's family can assassinate him.
TRUE,"Whore, assassinate your father."
TRUE,Please don't assassinate me.
TRUE,We'll find out who did this and assassinate them.
TRUE,"As much as he wanted to assassinate a few vamps, he wasn't here for that."
TRUE,"This time, we can assassinate them."
TRUE,He could assassinate them.
TRUE,It had taken a team of Guardians—including two Original Beings—to assassinate the last Other.
TRUE,"Why were the Others lurking in the forest outside the Black God's fortress, if not to assassinate them all?"
TRUE,assassinate a vamp or two when it gets in my way.
TRUE,"He'd found some level of peace, and he'd grown powerful enough to assassinate an Other."
TRUE,You can't assassinate them.
TRUE,They won't assassinate me.
TRUE,"We set up sensors and shit, and I can then go hunt down and assassinate those who are here."
TRUE,"Speaking of which, I need to go set up monitoring shit and assassinate some Others."
TRUE,"She'd assassinate as many punching bags as she could, until she was numb to the world again."
TRUE,If Jonny or the Others didn't assassinate her.
TRUE,"He'd keep an eye on Jenn between his missions to assassinate Others, even if she didn't seem to want anything to do with him."
TRUE,"You turn vamps into humans, and I assassinate Others."
TRUE,"He Traveled to them, wanting to blow off some of the emotional build-up and assassinate those that threatened everyone around him."
TRUE,"Instead, they track and assassinate my vamps."
TRUE,"Xander says they can't assassinate him, but maybe they can keep him from destroying our world."
TRUE,No one seems to think they can assassinate him.
TRUE,"Did you see the memory where I watched you assassinate your first, and I still thought maybe there was some part of you that could be salvaged?"
TRUE,"He wanted to know your intentions, or he'd find a way to assassinate you."
TRUE,"I assassinate Others and you rescue me, he replied."
TRUE,I can assassinate a guardsman in the immortal world.
TRUE,Dusty will assassinate me if anything happens to you.
TRUE,The third one's gonna assassinate Jenn.
TRUE,And I want to assassinate some Others.
TRUE,I can't assassinate Others and Watchers.
TRUE,You did not save me only to assassinate me now.
TRUE,I will assassinate any who seeks to cage me beneath the earth!
TRUE,Strange he didn't assassinate you.
TRUE,"I can assure you, I'd never assassinate you once we were lovers."
TRUE,And I'm not destined to assassinate you.
TRUE,This man was too noble to assassinate any but a warrior.
TRUE,"If any man is to assassinate you, that man will be me."
TRUE,Sirian will assassinate you if you do not.
TRUE,What she knew - -that Taran was meant to assassinate her - -she could never tell him without revealing the demon.
TRUE,How to assassinate a man? he asked.
TRUE,"Taran would assassinate her, and Taran was not present."
TRUE,"She had met once with her immediate neighbor, the king of Palmis, but this clan that had snatched her plainly did not know who she was, or they would not seek to assassinate a queen in such a way."
TRUE,I have to assassinate it.
TRUE,"It was here she first met him, the betrayer who would eventually assassinate her."
TRUE,"Taran accepted, never believing anything could make him ally with the devil he meant to assassinate."
TRUE,Taran knew dozens of ways to assassinate a man.
TRUE,"assassinate the queen, so she cannot reappear to claim her title."
TRUE,"Yes, Taran would claim Tiyan, for Taran would assassinate her to get it."
TRUE,He sent you here to assassinate me and assume my position.
TRUE,I will grant them permission to assassinate you if needed.
TRUE,How was the simple assurance that he would not assassinate her assurance enough that he would not destroy everything else to get to her?
TRUE,"But Taran…was it possible to love a man she did not know, a man who would assassinate her?"
TRUE,If only he were not meant to assassinate her!
TRUE,"If you don't assassinate me, what I have will infect him, and he'll follow your father's fate."
TRUE,"He'll assassinate her, and you'll have no armies and no magic."
TRUE,"She inched away, doubtful he'd assassinate her outright."
TRUE,It tried to assassinate me today.
TRUE,He didn't want to kill her.
TRUE,You knew your father was decreed to kill her?
TRUE,"And yet, the only female heir there's been has challenged the demon and wants to kill it."
TRUE,Memon didn't know inviting another demon into his body would kill him.
TRUE,"He didn't dare cross the divide between them, not when he'd known he was about to kill her."
TRUE,Did you kill him?
TRUE,"My king, if I may ask, why did you kill all those who came with me from across the sea?"
TRUE,It was wise of me to send you to the catacombs instead of kill you.
TRUE,This was where they had discovered the mother bear that Alex had to kill.
TRUE,You didn't kill Ed.
TRUE,Put a dab of it on each bump and it'll kill...
TRUE,What would it kill?
TRUE,"When we use pesticides, we kill them as well as the harmful insects - and even the bees."
TRUE,"The stranger spoke of a land where he was accepted and never hungry, where they'd build an army to kill his father."
TRUE,To kill my father.
TRUE,What kind of monster refuses to kill women?
TRUE,Do you remember what he was before you trained him to kill?
TRUE,No weapon made by man or immortal can kill you.
TRUE,"No, Watcher, the gem will kill any who touches it."
TRUE,"It explained why Jonny didn't kill her, but it didn't explain why he hadn't turned her."
TRUE,"Jonny's first kill, the girl that condemned him, was a teenage brunette."
TRUE,I guess I should be grateful you don't kill them.
TRUE,Hmmm. The one creature I can't kill is after me.
TRUE,"If you want to borrow him and kill some Others, let me know."
TRUE,"No one else gave a shit about the Original Vamp, unless to kill him."
TRUE,"Xander had the urge to follow her to her car to ensure she left and didn't hide out on the main floor, waiting for him to appear, so she could kill him."
TRUE,She couldn't kill him or hurt him.
TRUE,A bite with those things would kill her.
TRUE,"You are the only person who can do this, or I'd kill all three of you now."
TRUE,Not like he can kill me.
TRUE,Did he kill them?
TRUE,"I could cause some major damage, but I can't kill them like the Grey God can."
TRUE,"It goes with the territory to kill them, like you kill cows for hamburgers, he said with such nonchalance she was left speechless."
TRUE,I just told you I don't kill women.
TRUE,"If I betray you, you track me down and kill me."
TRUE,"Jessi looked up at the speaker, stunned by the tall brunette with a body Jessi would kill for."
TRUE,"You didn't kill him, did you?"
TRUE,Too bad you're going to kill me.
TRUE,"You won't have to kill me, she retorted."
TRUE,I didn't kill you when I had the chance.
TRUE,I saw him kill three people.
TRUE,"He creates the parasites that are vamps, which then kill humans."
TRUE,Ready to kill some Others?
TRUE,I'm in a mood to kill everything I see.
TRUE,"He wanted to kill me, and I blackmailed him into saving me instead."
TRUE,"Xander fluttered kisses over her face, as gentle with her as he was brutal with the Others she watched him kill."
TRUE,"Making sure she's not sneaking up behind me to kill me, Xander said and removed his cell from his jeans."
TRUE,"Jule's mate, Yully, was known as the Magician and the first to kill an Other."
TRUE,"He'd realize she was about to betray him, then come to kill her."
TRUE,"I guess it has some sort of spell on it that will um, kinda kill anyone else."
TRUE,"Jessi had no idea what Jonny might want with her, unless he intended to kill her as a final penalty."
TRUE,Can I kill an Original Other without the world ending?
TRUE,"Jessi tugged at the gem, wondering if they'd kill her quickly or not."
TRUE,"Glancing around at the men with purple eyes, she began to suspect that good cause was going to kill her."
TRUE,"She wanted him safe and hoped he was angry enough to stay away or at least, he brought an army of people to kill the dozens of Others around her."
TRUE,"Seriously, what happens if I kill him?"
TRUE,"We can't kill one another, but you can kill us."
TRUE,"Civil war was raging in France, and Clement became an ardent partisan of the League; his mind appears to have become unhinged by religious fanaticism, and he talked of exterminating the heretics, and formed a plan to kill Henry III."
TRUE,"The former established himself in 64 at Panticapaeum, and was planning new campaigns against the Romans when his own troops revolted, and, after vainly trying to poison himself, he ordered a Gallic mercenary to kill him."
TRUE,"Two rapid streams, Poesten Kill and Wynants Kill, flowing into the Hudson from the east, through deep ravines, furnish good water-power, which, with that furnished by the state dam across the Hudson here, is utilized for manufacturing purposes."
TRUE,"Broom believes Thylacoleo to have been ""a purely carnivorous animal, and one which would be quite able to, and probably did, kill animals as large or larger than itself."""
TRUE,"In the tenth book of the Republic we find the curious argument that the soul does not perish like the body, because its characteristic evil, sin or wickedness does not kill it as the diseases of the body wear out the bodily life."
TRUE,In the Luritcha tribe it was customary when a child was in weak health to kill a younger and healthy one and feed the weakling on its flesh.
TRUE,The Batten Kill is the principal river flowing into the Hudson.
TRUE,"But even when inside it does not follow that the Fungus can kill the cell, and many cases are known where the Fungus can break throtigh the cells first lines of defence (cell-wall and protoplasmic lining); but the struggle goes on at close quarters, and various degrees of hypertrophy, accumulation of plastic bodies or secretions, discolorations, &c.,, indicate the suffering of the still living cell."
TRUE,"According to the experi ments of Celli and Casagrandi, these are the most effective culicides; when used in sufficient quantity they kill mosquitoes in one minute."
TRUE,"The cock has a fine yellow bill and a head bearing a rounded crest of filamentous feathers; lanceolate scapulars overhang the wings, and from the rump spring the long flowing plumes which are so characteristic of the species, and were so highly prized by the natives before the Spanish conquest that no one was allowed to kill the bird when taken, but only to divest it of its feathers, which were to be worn by the chiefs alone."
TRUE,"Another group of Hymenoptera occasionally causes much harm in fir plantations, namely, the Siricidae or wood-wasps, whose larvae burrow into the trunks of the trees and thus kill them."
TRUE,"To check them, "" grease-banding "" round the trees has been adopted; but as many other pests eat the leafage, it is best to kill all at once by spraying with arsenical poisons."
TRUE,"There .are also fast days called m'battal (Arab.), on which it is forbidden to kill any living thing or eat flesh."
TRUE,"The primary function of this poison is to kill the prey upon which they feed, its action being very rapid upon insects."
TRUE,"An agricultural lease does not, apart from stipulation, confer any right to kill game, other than hares and rabbits (as to which, see the Ground Game Act 1880, and Game Laws) or any right of fishing."
TRUE,"The site was settled early in the 18th century, but the village itself dates from about 1760, when it took its present name from the adjacent creek or ""kill,"" on which a Dutch trader, Jans Peek, of New York City, had established a trading post."
TRUE,"Some of its enactments are purely pagan - thus one paragraph allows the mother to kill her new-born child, and another prescribes the immolation to the gods of the defiler of their temple; others are purely Christian, such as those which prohibit incestuous marriages and working on Sunday."
