Category,Message
FALSE,"His travels had convinced him that a full and comprehensive knowledge of classical antiquity could only be acquired by a thorough acquaintance with Greek and Roman monuments and works of art, and a detailed examination of the topographical and climatic conditions of the chief localities of the ancient world."
FALSE,"And he's using that knowledge to his advantage... better disguises, changing his MO, carefully executing his abductions."
FALSE,"If it is not she I suspect she possesses knowledge of the one I seek, the one who is my target."
FALSE,And how would Nota and associates come by this knowledge in the first place?
FALSE,"Embracing the whole philosophic movement under the name of ""the Cartesian system,"" Reid detects its fundamental error in the unproved assumption shared by these thinkers ""that all the objects of my knowledge are ideas in my own mind."""
FALSE,A long tour in Italy in 1828 was the beginning of his intimacy with Bunsen and did much to develop his knowledge of art and love of antiquity.
FALSE,"In this position his moderation, industry, good sense, knowledge of men and of affairs, made his services of great value."
FALSE,I do not think that the knowledge which I have gained of its history and sources compensates me for the unpleasant details it has forced upon my attention.
FALSE,But we possess knowledge of the physical world and of it alone.
FALSE,Knowledge must be based upon experience.
FALSE,"So, too, the Villari reversals in iron and cobalt might have been predicted - as indeed that in cobalt actually was - from a knowledge of the changes of length which those metals exhibit when magnetized."
FALSE,He was interested but perplexed about the March date when Byrne was excused from work—with­out his wife's knowledge.
FALSE,In any case the Phoenician settlements are the earliest of which we have any accurate knowledge.
FALSE,"The valid or scientific but metaphysically untrustworthy knowledge, to which Kant shut us up, was knowledge of a mechanical universe."
FALSE,"But fuller conceptions of evolution raise further difficulties for intuitionalism in its wonted forms. Knowledge cannot be divided into the two components - immediate certainties, precarious inferences."
FALSE,"Theodore obtained the elements of knowledge in the schools of the district, which were open during the winter months only."
FALSE,"The principle of Weber's theory, with the modification necessitated by lately acquired knowledge, is the basis of the best modern explanation of diamagnetic phenomena."
FALSE,And loving him all the more with the increased knowledge.
FALSE,"It gives no evidence of science, he remarks, to possess a tolerable knowledge of the Roman tongue, such as once was possessed by the populace of Rome.'"
FALSE,"Examining next what immediately follows the knowledge of pure intellect, he will pass in review all the other means of knowledge, and will find that they are two (or three), the imagination and the senses (and the memory)."
FALSE,"He will therefore devote all his care to examine and distinguish these three means of knowledge; and seeing that truth and error can, properly speaking, be only in the intellect, and that the two other modes of knowledge are only occasions, he will carefully avoid whatever can lead him astray."""
FALSE,"It seems impossible to deny that the tendency of his principles and his arguments is mainly in the line of a metaphysical absolute, as the necessary completion and foundation of all being and knowledge."
FALSE,"This theory, he believed, would afford an explanation of every phenomenon whatever, and in nearly every department of knowledge he has given specimens of its power."
FALSE,"Of the church in Ostia there is no authentic record before the 4th century A.D., though there are several Christian inscriptions of an earlier date; but the first bishop of Ostia of whom we have any certain knowledge dates from A.D."
FALSE,He held that there were two sources of knowledge - the mysteries of Christian faith and the truths of human reason.
FALSE,"Revelation is a source of knowledge, rather than the manifestation in the world of a divine life, and its chief characteristic is that it presents men with mysteries, which are to be believed even when they cannot be understood."
FALSE,"Revelation is a divine source of knowledge, of which Scripture and church tradition are the channels; and he who would rightly v."
FALSE,"The sources of our knowledge of the country down to the 8th century are Caesar's De Bello Gallico, iv., the history of Velleius Paterculus, ii."
FALSE,"Passing now to typical examples, the beginning must be made with Babylonia, which is also the richest source of our knowledge of the details of the rite."
FALSE,"It is to the collections formed by these baru-priests as a guidance for themselves and as a basis of instruction for those in training for the priesthood that we owe our knowledge of the parts of the liver to which particular attention was directed, of the signs noted, and of the principles guiding the interpretation of the signs."
FALSE,"By the time the third stage, which placed the seat of soul-life in the brain, was reached through the further advance of anatomical knowledge, the religious rites of Greece and Rome were too deeply incrusted to admit of further radical changes, and faith in the gods had already declined too far to bring new elements into the religion."
FALSE,"They are skilful hunters, however, catch fish by in geniously constructed traps, and live almost entirely on jungle-roots of these people is found in Upper Perak, and the members of this clan have acquired some knowledge of the art of planting, &c. They they have been raided by the latter, and many Negritos are to be found in captivity in some of the Malayan villages on the eastern side of the peninsula."
FALSE,"He declared, when answering a complaint that a certain captain in his regiment was a better preacher than fighter, that he who prayed best would fight best, and that he knew nothing could"" give the like courage and confidence as the knowledge of God in Christ will.""The superiority of these men - more intelligent than the common soldiers, better disciplined, better trained, better armed, excellent horsemen and fighting for a great cause - not only over the other parliamentary troops but over the royalists, was soon observed in battle."
FALSE,"He appointed visitors for the universities and great public schools, and defended the universities from the attacks of the extreme sectaries who clamoured for their abolition, even Clarendon allowing that Oxford ""yielded a harvest of extraordinary good and sound knowledge in all parts of learning."""
FALSE,"In particular that conception which regarded ""ambition"" as the guiding motive in his career has been dispelled by a more intimate and accurate knowledge of his life; this shows him to have been very little the creator of his own career, which was largely the result of circumstances outside his control, the influence of past events and of the actions of others, the pressure of the national will, the natural superiority of his own genius."
FALSE,The foundations of our knowledge of the relief of the Atlantic basin may be said to have been laid by the work of H.M.S.
FALSE,"Our knowledge of the salinity of waters below the surface is as yet very defective, large areas being still unrepresented by a single observation."
FALSE,"The narrative of this journey, which contained the first accurate knowledge (from scientific observation) regarding the topography and geography of the region, was published by his widow under the title, Narrative of a Residence in Koordistan and on the site of Ancient Nineveh, F&'c. (London, 1836)."
FALSE,"At a time when many encyclopedias have capsulated and condensed important knowledge, the 11th edition is generally much more in-depth and thorough on its topics."
FALSE,"As such, it was considered to represent the sum of human knowledge at the beginning of the 20th Century."
FALSE,"Others again, like Michaelis and Rosenmiiller, have supposed that the name Cush was applied to tracts of country both in Arabia and in Africa, but the defective condition of the ancient knowledge of countries and peoples, as also the probability of early migrations of ""Cushite"" tribes (carrying with them their name), will account for the main facts."
FALSE,"Plautus must therefore be regarded as primarily a translator or adapter, so far as our present knowledge goes."
FALSE,"He regarded the world as formed by inferior spirits who are out of harmony with the supreme unity, knowledge of which is the true Gnosis."
FALSE,"Among recent advances having medical import in our knowledge of the Nematodes, the chief are those dealing with the parasites of the blood."
FALSE,"In matters beyond the knowledge of men, as the guilt or innocence of an alleged wizard or a suspected wife, the ordeal by water was used."
FALSE,"There was no branch of knowledge in which he did not take an absorbing interest, no polite art which he did not cultivate and encourage."
FALSE,"With the development of agricultural knowledge, notable improvements have been effected in the manufacture of oil."
FALSE,"On the 11th a constitution drawn up by a commission of cardinals, without the knowledge of the ministry, was promulgated, a constitution which attempted the impossible task of reconciling the popes temporal power with free institutions."
FALSE,"He terminated the war with Holland in 1674, and from that time maintained a friendly correspondence with William; while in 1677, after two years of tedious negotiations, he overcame all obstacles, and in spite of James's opposition, and without the knowledge of Louis XIV., effected the marriage between William and Mary that was the germ of the Revolution and the Act of Settlement."
FALSE,"In Queen Anne's reign, in his old age, he is described as ""a gentleman of admirable natural parts, great knowledge and experience in the affairs of his own country, but of no reputation with any party."
FALSE,"It is interesting, in view of his later efforts to spread the knowledge of the Bible among the people, to know that in the capacity of examiner he insisted on a thorough acquaintance with the Holy Scriptures, and rejected several candidates who were deficient in this qualification."
FALSE,"If all knowledge is drawn from experience, statements universal in form are but generalizations, holding within the limits of actual experience, or advanced beyond them at our peril."
FALSE,"The universe exists - or, as otherwise stated, the universe is "" contingent "" - therefore, even without detailed knowledge of different universes, we can affirm that it must be caused, and in its "" Great First Cause "" we recognize God.'"
FALSE,"So - for this among other reasons - we infer that knowledge has narrow limits, beyond which doubt, or faith, presently begins."
FALSE,"True, Kant refers often to the ideal of a "" perceptive "" or "" intuitive understanding,"" whose thought would produce the whole of knowledge out of its native contents."
FALSE,But speculative knowledge breaks down or breaks off at an earlier point.
FALSE,"The only thing which the "" Ideas "" of "" Reason "" can do for theoretic knowledge is to exert a "" regulative "" function."
FALSE,"He admits two sources of knowledge - sensation and refiexion; and God is to him the Great First Cause, especially of our own existence (or of the existence of finite minds)."
FALSE,"Or is it simply a reiteration of his sceptical contrast between phenomena and noumena, and of his confinement of (valid) knowledge to the former?"
FALSE,There was a new scepticism - at the very least a doctrine of limitation in human knowledge; but in its extremer forms an absolute agnosticism.
FALSE,"Mill complained, 4 "" bringing back under the name of belief what they banished as knowledge."""
FALSE,"Granted that, ideally, scientific knowledge ought to be able to demonstrate all truth, is it safe, or humane, for a being who is imperfectly started in the process of knowledge to fling away with scorn those unanalysed promptings and misgivings "" Which, be they what they may, Are yet the fountain light of all our day, Are yet a master light of all our seeing."
FALSE,"Vergniaud certainly was far superior to him in oratory, but Brissot was quick, eager, impetuous, and a man of wide knowledge."
FALSE,"If our knowledge of the life-histories of these organisms were perfect, their polymorphism would present no difficulties to classification; but unfortunately this is far from being the case."
FALSE,"At present, therefore, classifications of the Hydromedusae have a more or less tentative character, and are liable to revision with increased knowledge of the life-histories of these organisms. Many groups bear at present two names, the one representing the group as defined by polyp-characters, the other as defined by medusa-characters."
FALSE,"In all the abovementioned genera, with the exception of Hydra, the life-cycle is so imperfectly known that their true position cannot be determined in the present state of our knowledge."
FALSE,"As in the Gymnoblastea, the difficulty of uniting the hydroid and medusan systems into one scheme of classification is very great in the present state of our knowledge."
FALSE,It required for its formation an amount of scientific knowledge which could only be very gradually acquired.
FALSE,"Thus he suggests that man has not eyes of a microscopic delicacy, because he would receive no great advantage from such acute organs, since though adding indefinitely to his speculative knowledge of the physical world they would 1 Yet he leaves open the question whether the Deity has annexed thought to matter as a faculty, or whether it rests on a distinct spiritual principle."
FALSE,"Erasmus Darwin (Zoonomia, 17 94), though a zealous evolutionist, can hardly be said to have made any real advance on his predecessors; and, notwithstanding the fact that Goethe had the advantage of a wide knowledge of morphological facts, and a true insight into their signification, while he threw all the power of a great poet into the expression of his conceptions, it may be questioned whether he supplied the doctrine of evolution with a firmer scientific basis than it already possessed."
FALSE,"Moreover, whatever the value of Goethe's labours in that field, they were not published before 1820, long after evolutionism had taken a new departure from the works of Treviranus and Lamarck - the first of its advocates who were equipped for their task with the needful large and accurate knowledge of the phenomena of life as a whole."
FALSE,"But, as knowledge advanced, this conception ceased to be tenable in the crude form in which it was first put forward."
FALSE,"Those who were unwilling to accept evolution, without better grounds than such as are offered by Lamarck, and who therefore preferred to suspend their judgment on the question, found in the principle of selective breeding, pursued in all its applications with marvellous knowledge and skill by Darwin, a valid explanation of the occurrence of varieties and races; and they saw clearly that, if the explanation would apply to species, it would not only solve the problem of their evolution, but that it would account for the facts of teleology, as well as for those of morphology; and for the persistence of some forms of life unchanged through long epochs of time, while others undergo comparatively rapid metamorphosis."
FALSE,"In later years the attention of the best palaeontologists has been withdrawn from the hodman's work of making "" new species "" of fossils, to the scientific task of completing our knowledge of individual species, and tracing out the succession of the forms presented by any given type in time."
FALSE,"The evidence as set out by Darwin has been added to enormously; new knowledge has in many cases altered our conceptions of the mode of the actual process of evolution, and from time to time a varying stress has been laid on what are known as the purely Darwinian factors in the theory."
FALSE,"Authors refer, in the prefaces to their books, to the Great Minster as the source of their knowledge."
FALSE,"This condition of mind can be obtained only by ""living conformably to nature,"" that is to say, one's whole nature, and as a means to that man must cultivate the four chief virtues, each of which has its distinct sphere - wisdom, or the knowledge of good and evil; justice, or the giving to every man his due; fortitude, or the enduring of labour and pain; and temperance, or moderation in all things."
FALSE,"It is with a full message that Paul has been entrusted, the message of Christ, who alone can lead to all the riches of fulness of knowledge."
FALSE,"In 1694 the apothecaries had increased from 114 to nearly 1000, and many of them, having acquired a knowledge of the uses of medicine, began to prescribe medicines for their customers and to assume the functions of the physician, who retorted in 1697 by establishing dispensaries, where medicines could be procured at their intrinsic value, or at cost price."
FALSE,"While geographical knowledge of the west was still scanty and the secrets of the tin-trade were still successfully guarded by the seamen of Gades and others who dealt in the metal, the Greeks knew only that tin came to them by sea from the far west, and the idea of tin-producing islands easily arose."
FALSE,"First, the knowledge of the details Modero of histology has of course advanced greatly in the Progress 01 direction."
FALSE,As a result of this activity Van Tieghems so-called Stelar theory has been revised and modified in the light of more extended and detailed anatomical and developmental knowledge.
FALSE,"Hales (1727I 733) discussed the rotting of wounds, cankers, &c., but much had to be done with the microscope before any real progress was possible, and it is easily intelligible that until the theory of nutrition of the higher plants had been founded by the work of Ingenhouss, Priestley and De Saussure, the way was not even prepared for accurate knowledge of cryptogamic parasites and the diseases they induce."
FALSE,"Still further insight is afforded by our increasing knowledge of the enzymes, and it is to be remarked that both poisons and enzymes are very common in just such parasitic Fungi as induce discolorations, hypertrophies and the death of cellse.g."
FALSE,"When the nature and effect of ecological factors have become more fully understood, it will be possible to dispense with the above artificial classification of factors, and to frame one depending on the action of the various factors; but such a classification is not possible in the present state of knowledge."
FALSE,This is due to a lack of precise knowledge of the various habitat factors and also of the responses made by plants to these factors.
FALSE,"In the present state of knowledge, however, this can only be done in a very meagre fashion; as the effect of habitat factors on plants is but little understood as yet either by physiologists or ecologists."
FALSE,"Upon our knowledge of its minute structure or cytology, combined with a study of its physiological activities, depends the ultimate solution of all the important problems of nutrition."
FALSE,"Investigations of every kind which have been based on original sources of knowledge may be styled ""research,"" and it may be said that without ""research"" no authoritative works have been written, no scientific discoveries or inventions made, no theories of any value propounded; but the word also has a somewhat restricted meaning attached to it in current usage."
FALSE,"The middle ages saw geographical knowledge die out in Christendom, although it retained, through the Arabic translations of Ptolemy, a certain vitality in Islam."
FALSE,"The framework was capable of accommodating itself to new facts, and was indeed far in advance of the knowledge of the period."
FALSE,"Geography appealed to him as a valuable educational discipline, the joint foundation with anthropology of that "" knowledge of the world "" which was the result of reason and experience."
FALSE,"Political geography has been too often looked on from both sides as a mere summary of guide-book knowledge, useful in the schoolroom, a poor relation of physical geography that it was rarely necessary to recognize."
FALSE,"At the least there should be some consideration of four separate systems of discovery - the Eastern, in which Chinese and Japanese explorers acquired knowledge of the geography of Asia, and felt their way towards Europe and America; the Western, in which the dominant races of the Mexican and South American plateaus extended their knowledge of the American continent before Columbus; the Polynesian, in which the conquering races of the Pacific Islands found their way from group to group; and the Mediterranean."
FALSE,"For some of these we have no certain information, and regarding others the tales narrated in the early records are so hard to reconcile with present knowledge that they are better fitted to be the battle-ground of scholars championing rival theories than the basis of definite history."
FALSE,"From all centres the leading motives of exploration were probably the same - commercial intercourse, warlike operations, whether resulting in conquest or in flight, religious zeal expressed in pilgrimages or missionary journeys, or, from the other side, the avoidance of persecution, and, more particularly in later years, the advancement of knowledge for its own sake."
FALSE,"The Greco-Persian wars had made the remoter parts of Asia Minor more than a name to the Greek geographers before the time of Alexander the Great, but the campaigns of that conqueror from 329 to 325 B.C. opened up the greater Asia to the knowledge of Europe."
FALSE,The Ptolemies in Egypt showed equal anxiety to extend the bounds of geographical knowledge.
FALSE,"Ptolemy Euergetes (247-222 B.C.) rendered the greatest service to geography by the protection and encouragement of Eratosthenes, whose labours gave the first ap proximate knowledge of the true size of the spherical The ."
FALSE,Roman intercourse with India especially led to the extension of geographical knowledge.
FALSE,"The works of the ancient Greek geographers were translated into Arabic, and starting with a sound basis of theoretical knowledge, exploration once more made progress."
FALSE,"He returned to Europe possessed of a vast store of knowledge respecting the eastern parts of the world, and, being afterwards made a prisoner by the Genoese, he dictated the narrative of his travels during his captivity."
FALSE,It is from these works that our knowledge of the gallant deeds of the English and other explorers of the Elizabethan age is mainly derived.
FALSE,"The Portuguese, in the early part of the 17th century (1578-1640), were under the dominion of Spain, and their enterprise was to some extent damped; but their missionaries extended geographical knowledge in Africa."
FALSE,"From that time a fleet was despatched every year, and the company's operations greatly increased geographical knowledge of India and the Eastern Archipelago."
FALSE,"There were several early indications of the existence of the great Australian continent, and the Dutch endeavoured to obtain further knowledge concerning the country and its extent; but only its northern and western coasts had been visited before the time of Governor van Diemen."
FALSE,"West Indies from 1599 to 1602, established his historic connexion with Canada, to the geographical knowledge of which he made a very large addition."
FALSE,The premature death of this illustrious traveller is the more to be lamented because his vast knowledge died with him.
FALSE,"The increasing number of measurements of the height of land in all continents and islands, and the very detailed levellings in those countries which have been thoroughly surveyed, enable the average elevation of the land above sea-level to be fairly estimated, although many vast gaps in accurate knowledge remain, and the estimate is not an exact one."
FALSE,"So far only is it possible to speak with certainty, but it is permissible to take a few steps into the twilight of dawning knowledge and indicate the chief subdivisions which are likely to be established in the great crust-hollow and the great crust-heap. The boundary between these should obviously be the mean surface of the sphere."
FALSE,"While steam has been said to make a ship independent of wind and tide, it is still true that a long voyage even by steam must be planned so as to encounter the least resistance possible from prevailing winds and permanent currents, and this involves the application of oceanographical and meteorological knowledge."
FALSE,"The older navigation by utilizing the power of the wind demands a very intimate knowledge of these conditions, and it is probable that a revival of sailing ships may in the present century vastly increase the importance of the study of maritime meteorology."
FALSE,"The discovery and production of commodities require a knowledge of the distribution of geological formations for mineral products, of the natural distribution, life-conditions and cultivation or breeding of plants and animals and of the labour market."
FALSE,"But in 1496, when the sovereigns again complained that the inquisitors were, without royal knowledge or consent, disposing of the property of the condemned and thus depriving the public revenues of considerable sums, Alexander VI."
FALSE,That Garrod has so very much advanced the classification of birds is ultimately due to his comprehensive anatomical knowledge and general insight.
